DENOMINAZIONE   VARIABILE,DESCRIZIONE CAMPO,NOTE
COD_RIP,"della  (5  Codice Istat della ripartizione geografica che  suddivide il territorio nazionale in: 1) Nord- ovest,  2)  Nord-est,  3)  Centro,  4)  Sud  e  5)  Isole.",Codice  numerico  ripartizione  geografica  modalità).
,Denominazione  della  ripartizione  geografica  (5  modalità).,DEN_RIP
,"Nomenclatura  delle  unità  territoriali  per  le  statistiche  corrispondente  al  territoriale  delle  Il  codice  è  di  tipo  alfanumerico.  Regolamenti (UE) n. 105/2007 del 1/02/07,  n.  176/2008  e  n.  31/2011.  Nella  nomenclatura  NUTS  non  è  presente  la  regione  di  livello  2  ""Trentino-Alto  Adige/Südtirol"" che è sostituita dal dettaglio  ""Provincia  autonoma  di  Bolzano/Bozen""",COD_NUTS2_2010  europee  livello  Regioni.
,"Nomenclatura  delle  unità  territoriali  per  le  statistiche  europee  corrispondente  al  territoriale  delle  province.  Il  codice  è  di  tipo  Regolamenti (UE) n. 105/2007 del 1/02/07,  n. 176/2008 e n. 31/2011.",COD_NUTS3_2010  livello
COD_REG,Codice numerico che identifica  univocamente  le  20  regioni  italiane  sul  territorio  nazionale.,
COD_PROV,univocamente la provincia sul  territorio nazionale.,"delle  città  metropolitane,  il  codice  delle  provincia  cessa  la  sua  funzione  amministrativa  e  acquisisce  lo  ""status""  di  codice statistico. Il  codice  Istat  del  comune  si  ottiene  dalla"
PRO_COM,Codice numerico che identifica  univocamente  il  Comune  sul  territorio nazionale.,"concatenazione  del  codice  della  provincia  (COD_PROV),  con  il  codice  progressivo  comunale di tre digit."
PRO_COM_T,alfanumerico  che  univocamente  il  territorio  Il  codice  Istat  del  comune  di  6  caratteri  si  ottiene  dalla  concatenazione  del  codice  alfanumerico  di  tre  digit  della  provincia,Codice  identifica  Comune  sul
PRO_COM_103,Codice numerico che identifica  univocamente  il  Comune  sul  territorio nazionale.,"Il  valore  è  ottenuto concatenando il codice  della  provincia  (COD_PROV),  con  il  codice  progressivo  comunale  di  tre  digit,  ed  è  riferito  alla  situazione  antecedente  alla  costituzione  delle  quattro  nuove  province  della Sardegna."
